{
  "version": "1.0.0",
  "patterns": [
    "squat",
    "hinge",
    "lunge_unilateral",
    "horizontal_push",
    "horizontal_pull",
    "vertical_push",
    "vertical_pull",
    "carry",
    "core_anti_extension",
    "core_anti_rotation",
    "core_flexion",
    "rotation",
    "conditioning_steady",
    "conditioning_intervals"
  ],
  "muscles": [
    "quads",
    "hamstrings",
    "glutes",
    "adductors",
    "calves",
    "erectors",
    "lats",
    "upper_back",
    "chest",
    "delts_anterior",
    "delts_lateral",
    "delts_posterior",
    "biceps",
    "triceps",
    "forearms_grip",
    "abs",
    "obliques"
  ],
  "exercises": [
    {
      "id": "back_squat",
      "name": "Back Squat",
      "patterns": [
        "squat"
      ],
      "muscles": {
        "quads": 1.0,
        "glutes": 0.7,
        "erectors": 0.4
      },
      "equipment": [
        "barbell",
        "rack"
      ],
      "swap_group": "squat_main",
      "fatigue_cost": 0.9,
      "contraindications": [],
      "tags": [
        "main",
        "squat_main",
        "barbell"
      ]
    },
    {
      "id": "front_squat",
      "name": "Front Squat",
      "patterns": [
        "squat"
      ],
      "muscles": {
        "quads": 1.0,
        "glutes": 0.5,
        "erectors": 0.4
      },
      "equipment": [
        "barbell",
        "rack"
      ],
      "swap_group": "squat_main",
      "fatigue_cost": 0.9,
      "contraindications": [],
      "tags": [
        "main",
        "squat_main",
        "barbell"
      ]
    },
    {
      "id": "high_bar_squat",
      "name": "High Bar Squat",
      "patterns": [
        "squat"
      ],
      "muscles": {
        "quads": 1.0,
        "glutes": 0.6,
        "erectors": 0.4
      },
      "equipment": [
        "barbell",
        "rack"
      ],
      "swap_group": "squat_main",
      "fatigue_cost": 0.9,
      "contraindications": [],
      "tags": [
        "main",
        "squat_main",
        "barbell"
      ]
    },
    {
      "id": "low_bar_squat",
      "name": "Low Bar Squat",
      "patterns": [
        "squat"
      ],
      "muscles": {
        "quads": 0.85,
        "glutes": 0.8,
        "erectors": 0.5
      },
      "equipment": [
        "barbell",
        "rack"
      ],
      "swap_group": "squat_main",
      "fatigue_cost": 0.92,
      "contraindications": [],
      "tags": [
        "main",
        "squat_main",
        "barbell"
      ]
    },
    {
      "id": "paused_back_squat",
      "name": "Paused Back Squat",
      "patterns": [
        "squat"
      ],
      "muscles": {
        "quads": 1.0,
        "glutes": 0.7,
        "erectors": 0.45
      },
      "equipment": [
        "barbell",
        "rack"
      ],
      "swap_group": "squat_secondary",
      "fatigue_cost": 0.85,
      "contraindications": [],
      "tags": [
        "secondary",
        "squat_secondary",
        "barbell"
      ]
    },
    {
      "id": "tempo_squat",
      "name": "Tempo Squat",
      "patterns": [
        "squat"
      ],
      "muscles": {
        "quads": 1.0,
        "glutes": 0.7,
        "erectors": 0.4
      },
      "equipment": [
        "barbell",
        "rack"
      ],
      "swap_group": "squat_secondary",
      "fatigue_cost": 0.8,
      "contraindications": [],
      "tags": [
        "secondary",
        "squat_secondary",
        "barbell"
      ]
    },
    {
      "id": "box_squat",
      "name": "Box Squat",
      "patterns": [
        "squat"
      ],
      "muscles": {
        "quads": 0.9,
        "glutes": 0.8,
        "erectors": 0.45
      },
      "equipment": [
        "barbell",
        "rack",
        "box"
      ],
      "swap_group": "squat_secondary",
      "fatigue_cost": 0.82,
      "contraindications": [],
      "tags": [
        "secondary",
        "squat_secondary",
        "barbell"
      ]
    },
    {
      "id": "conventional_deadlift",
      "name": "Deadlift (Conventional)",
      "patterns": [
        "hinge"
      ],
      "muscles": {
        "hamstrings": 0.8,
        "glutes": 0.9,
        "erectors": 1.0,
        "forearms_grip": 0.4
      },
      "equipment": [
        "barbell"
      ],
      "swap_group": "hinge_main",
      "fatigue_cost": 1.0,
      "contraindications": [],
      "tags": [
        "main",
        "hinge_main",
        "barbell"
      ]
    },
    {
      "id": "sumo_deadlift",
      "name": "Deadlift (Sumo)",
      "patterns": [
        "hinge"
      ],
      "muscles": {
        "hamstrings": 0.6,
        "glutes": 0.9,
        "adductors": 0.7,
        "erectors": 0.9,
        "forearms_grip": 0.35
      },
      "equipment": [
        "barbell"
      ],
      "swap_group": "hinge_main",
      "fatigue_cost": 1.0,
      "contraindications": [],
      "tags": [
        "main",
        "hinge_main",
        "barbell"
      ]
    },
    {
      "id": "paused_deadlift",
      "name": "Paused Deadlift",
      "patterns": [
        "hinge"
      ],
      "muscles": {
        "hamstrings": 0.75,
        "glutes": 0.85,
        "erectors": 1.0,
        "forearms_grip": 0.4
      },
      "equipment": [
        "barbell"
      ],
      "swap_group": "hinge_secondary",
      "fatigue_cost": 0.9,
      "contraindications": [],
      "tags": [
        "secondary",
        "hinge_secondary",
        "barbell"
      ]
    },
    {
      "id": "romanian_deadlift_barbell",
      "name": "Romanian Deadlift (Barbell)",
      "patterns": [
        "hinge"
      ],
      "muscles": {
        "hamstrings": 1.0,
        "glutes": 0.8,
        "erectors": 0.8
      },
      "equipment": [
        "barbell"
      ],
      "swap_group": "hinge_secondary",
      "fatigue_cost": 0.85,
      "contraindications": [],
      "tags": [
        "secondary",
        "hinge_secondary",
        "barbell"
      ]
    },
    {
      "id": "stiff_leg_deadlift",
      "name": "Stiff-leg Deadlift",
      "patterns": [
        "hinge"
      ],
      "muscles": {
        "hamstrings": 1.0,
        "glutes": 0.7,
        "erectors": 0.85
      },
      "equipment": [
        "barbell"
      ],
      "swap_group": "hinge_secondary",
      "fatigue_cost": 0.88,
      "contraindications": [],
      "tags": [
        "secondary",
        "hinge_secondary",
        "barbell"
      ]
    },
    {
      "id": "bench_press",
      "name": "Bench Press",
      "patterns": [
        "horizontal_push"
      ],
      "muscles": {
        "chest": 1.0,
        "triceps": 0.6,
        "delts_anterior": 0.5
      },
      "equipment": [
        "barbell",
        "bench"
      ],
      "swap_group": "bench_main",
      "fatigue_cost": 0.85,
      "contraindications": [],
      "tags": [
        "main",
        "bench_main",
        "barbell"
      ]
    },
    {
      "id": "paused_bench_press",
      "name": "Paused Bench Press",
      "patterns": [
        "horizontal_push"
      ],
      "muscles": {
        "chest": 1.0,
        "triceps": 0.6,
        "delts_anterior": 0.5
      },
      "equipment": [
        "barbell",
        "bench"
      ],
      "swap_group": "bench_secondary",
      "fatigue_cost": 0.8,
      "contraindications": [],
      "tags": [
        "secondary",
        "bench_secondary",
        "barbell"
      ]
    },
    {
      "id": "close_grip_bench",
      "name": "Close Grip Bench Press",
      "patterns": [
        "horizontal_push"
      ],
      "muscles": {
        "chest": 0.7,
        "triceps": 1.0,
        "delts_anterior": 0.4
      },
      "equipment": [
        "barbell",
        "bench"
      ],
      "swap_group": "bench_secondary",
      "fatigue_cost": 0.8,
      "contraindications": [],
      "tags": [
        "secondary",
        "bench_secondary",
        "barbell"
      ]
    },
    {
      "id": "incline_bench_barbell",
      "name": "Incline Bench Press (Barbell)",
      "patterns": [
        "horizontal_push"
      ],
      "muscles": {
        "chest": 0.85,
        "delts_anterior": 0.75,
        "triceps": 0.55
      },
      "equipment": [
        "barbell",
        "bench"
      ],
      "swap_group": "press_secondary",
      "fatigue_cost": 0.78,
      "contraindications": [],
      "tags": [
        "secondary",
        "press_secondary",
        "barbell"
      ]
    },
    {
      "id": "overhead_press",
      "name": "Overhead Press",
      "patterns": [
        "vertical_push"
      ],
      "muscles": {
        "delts_anterior": 0.9,
        "triceps": 0.6,
        "upper_back": 0.2
      },
      "equipment": [
        "barbell"
      ],
      "swap_group": "ohp_main",
      "fatigue_cost": 0.85,
      "contraindications": [],
      "tags": [
        "main",
        "ohp_main",
        "barbell"
      ]
    },
    {
      "id": "push_press",
      "name": "Push Press",
      "patterns": [
        "vertical_push"
      ],
      "muscles": {
        "delts_anterior": 0.9,
        "triceps": 0.5,
        "quads": 0.3,
        "glutes": 0.3
      },
      "equipment": [
        "barbell"
      ],
      "swap_group": "ohp_secondary",
      "fatigue_cost": 0.9,
      "contraindications": [],
      "tags": [
        "secondary",
        "ohp_secondary",
        "barbell"
      ]
    },
    {
      "id": "barbell_row",
      "name": "Barbell Row",
      "patterns": [
        "horizontal_pull"
      ],
      "muscles": {
        "upper_back": 0.8,
        "lats": 0.7,
        "biceps": 0.5,
        "erectors": 0.4
      },
      "equipment": [
        "barbell"
      ],
      "swap_group": "horizontal_pull_secondary",
      "fatigue_cost": 0.75,
      "contraindications": [],
      "tags": [
        "secondary",
        "horizontal_pull",
        "barbell",
        "horizontal_pull_accessory",
        "horizontal_pull_secondary"
      ]
    },
    {
      "id": "pendlay_row",
      "name": "Pendlay Row",
      "patterns": [
        "horizontal_pull"
      ],
      "muscles": {
        "upper_back": 0.85,
        "lats": 0.65,
        "biceps": 0.5,
        "erectors": 0.45